{
 "pdb_id": "10PI",
 "ligand_code": "A1C68",
 "ligand_chain": "A",
 "interactions": [
  {
   "type": "hbond",
   "residue": "GLY",
   "chain": "A",
   "resnum": 884,
   "ligand_atom": "2393",
   "protein_atom": null,
   "distance_a": 3.07,
   "angle_deg": 105.5,
   "protein_is_donor": true,
   "ligand_coords": [
    20.282,
    -13.258,
    33.389
   ],
   "protein_coords": [
    21.712,
    -16.29,
    34.255
   ]
  },
  {
   "type": "hbond",
   "residue": "GLY",
   "chain": "A",
   "resnum": 887,
   "ligand_atom": "2393",
   "protein_atom": null,
   "distance_a": 2.98,
   "angle_deg": 110.1,
   "protein_is_donor": true,
   "ligand_coords": [
    20.282,
    -13.258,
    33.389
   ],
   "protein_coords": [
    23.472,
    -12.039,
    33.822
   ]
  },
  {
   "type": "hbond",
   "residue": "LEU",
   "chain": "A",
   "resnum": 959,
   "ligand_atom": "2389",
   "protein_atom": null,
   "distance_a": 1.95,
   "angle_deg": 172.5,
   "protein_is_donor": true,
   "ligand_coords": [
    13.106,
    -15.628,
    45.947
   ],
   "protein_coords": [
    11.775,
    -16.159,
    48.502
   ]
  },
  {
   "type": "hydrophobic",
   "residue": "ALA",
   "chain": "A",
   "resnum": 906,
   "ligand_atom": "2379",
   "protein_atom": "309",
   "distance_a": 3.74,
   "angle_deg": null,
   "protein_is_donor": null,
   "ligand_coords": [
    13.467,
    -12.978,
    43.444
   ],
   "protein_coords": [
    16.098,
    -12.897,
    46.099
   ]
  },
  {
   "type": "hydrophobic",
   "residue": "PHE",
   "chain": "A",
   "resnum": 958,
   "ligand_atom": "2386",
   "protein_atom": "674",
   "distance_a": 3.87,
   "angle_deg": null,
   "protein_is_donor": null,
   "ligand_coords": [
    13.644,
    -17.786,
    45.127
   ],
   "protein_coords": [
    15.459,
    -18.198,
    48.524
   ]
  },
  {
   "type": "hydrophobic",
   "residue": "LEU",
   "chain": "A",
   "resnum": 1010,
   "ligand_atom": "2376",
   "protein_atom": "1119",
   "distance_a": 3.95,
   "angle_deg": null,
   "protein_is_donor": null,
   "ligand_coords": [
    14.261,
    -15.988,
    42.454
   ],
   "protein_coords": [
    10.622,
    -17.521,
    42.467
   ]
  },
  {
   "type": "water_bridge",
   "residue": "HIS",
   "chain": "A",
   "resnum": 885,
   "ligand_atom": null,
   "protein_atom": null,
   "distance_a": 3.48,
   "angle_deg": 128.6,
   "protein_is_donor": true,
   "ligand_coords": [
    20.282,
    -13.258,
    33.389
   ],
   "protein_coords": [
    23.088,
    -15.518,
    30.977
   ],
   "distance_donor_water_a": 2.9,
   "water_idx": 2582
  }
 ]
}